<?xml version='1.0' encoding='utf-8'?>
<festival xmlns:xsi="http://www.w3.org/2001/XMLSchema-instance" id="ppf2026" lang="cs" xsi:noNamespaceSchemaLocation="festival.xsd">
  <nazev>Prague Pulse Fest</nazev>
  <mistokonani>
    <ulice>U Výstaviště 67</ulice>
    <mesto>Praha</mesto>
    <psc>170 00</psc>
  </mistokonani>
  <popis_festivalu>Prague Pulse Fest je fiktivní třídenní multižánrový festival kombinující koncerty, DJ sety a doprovodný program v městském areálu v Praze.</popis_festivalu>
  <dny>
    <den id="d1">
      <nazev>Den 1</nazev>
      <tema_dne>Opening Night</tema_dne>
      <popis>Lorem ipsum dolor sit amet, consectetur adipiscing elit.</popis>
      <datumstart>2026-08-01</datumstart>
      <casstart>09:00:00</casstart>
      <caskonec>23:59:00</caskonec>
    </den>
    <den id="d2">
      <nazev>Den 2</nazev>
      <tema_dne>Main Stage Highlights</tema_dne>
      <popis>Lorem ipsum dolor sit amet, consectetur adipiscing elit.</popis>
      <datumstart>2026-08-02</datumstart>
      <casstart>09:00:00</casstart>
      <caskonec>23:59:00</caskonec>
    </den>
    <den id="d3">
      <nazev>Den 3</nazev>
      <tema_dne>Finale &amp; Afterparty</tema_dne>
      <popis>Lorem ipsum dolor sit amet, consectetur adipiscing elit.</popis>
      <datumstart>2026-08-03</datumstart>
      <casstart>09:00:00</casstart>
      <caskonec>23:59:00</caskonec>
    </den>
  </dny>
  <haly>
    <hala id="h1">
      <nazev>Main Hall</nazev>
      <lokace>Areál – Hala A</lokace>
      <velikost>5000</velikost>
      <popis>Hlavní krytá hala pro večerní headline sety a velké koncerty.</popis>
    </hala>
    <hala id="h2">
      <nazev>River Stage</nazev>
      <lokace>Areál – Open Air</lokace>
      <velikost>3000</velikost>
      <popis>Open-air stage u řeky pro odpolední koncerty a sunset program.</popis>
    </hala>
    <hala id="h3">
      <nazev>Club Stage</nazev>
      <lokace>Areál – Hala B</lokace>
      <velikost>1500</velikost>
      <popis>Menší klubová scéna pro intimnější sety, DJs a afterparty.</popis>
    </hala>
  </haly>
  <interpreti>
    <interpret id="i1">
      <nazev>Neon Echo</nazev>
      <typ_interpreta>Solo</typ_interpreta>
      <zanr>Rock</zanr>
      <popis>Neon Echo je fiktivní solo zaměřený na žánr rock a živá festivalová vystoupení.</popis>
    </interpret>
    <interpret id="i2">
      <nazev>Neon Pulse</nazev>
      <typ_interpreta>Skupina</typ_interpreta>
      <zanr>Pop</zanr>
      <popis>Neon Pulse je fiktivní skupina zaměřený na žánr pop a živá festivalová vystoupení.</popis>
    </interpret>
    <interpret id="i3">
      <nazev>Neon Drift</nazev>
      <typ_interpreta>Solo</typ_interpreta>
      <zanr>Jazz</zanr>
      <popis>Neon Drift je fiktivní solo zaměřený na žánr jazz a živá festivalová vystoupení.</popis>
    </interpret>
    <interpret id="i4">
      <nazev>Neon Horizon</nazev>
      <typ_interpreta>Skupina</typ_interpreta>
      <zanr>Elektronika</zanr>
      <popis>Neon Horizon je fiktivní skupina zaměřený na žánr elektronika a živá festivalová vystoupení.</popis>
    </interpret>
    <interpret id="i5">
      <nazev>Neon Mirage</nazev>
      <typ_interpreta>Solo</typ_interpreta>
      <zanr>Hip-Hop</zanr>
      <popis>Neon Mirage je fiktivní solo zaměřený na žánr hip-hop a živá festivalová vystoupení.</popis>
    </interpret>
    <interpret id="i6">
      <nazev>Neon Bloom</nazev>
      <typ_interpreta>Skupina</typ_interpreta>
      <zanr>Folk</zanr>
      <popis>Neon Bloom je fiktivní skupina zaměřený na žánr folk a živá festivalová vystoupení.</popis>
    </interpret>
    <interpret id="i7">
      <nazev>Neon Nova</nazev>
      <typ_interpreta>Solo</typ_interpreta>
      <zanr>Rock</zanr>
      <popis>Neon Nova je fiktivní solo zaměřený na žánr rock a živá festivalová vystoupení.</popis>
    </interpret>
    <interpret id="i8">
      <nazev>Neon Wave</nazev>
      <typ_interpreta>Skupina</typ_interpreta>
      <zanr>Pop</zanr>
      <popis>Neon Wave je fiktivní skupina zaměřený na žánr pop a živá festivalová vystoupení.</popis>
    </interpret>
    <interpret id="i9">
      <nazev>Neon Sphere</nazev>
      <typ_interpreta>Solo</typ_interpreta>
      <zanr>Jazz</zanr>
      <popis>Neon Sphere je fiktivní solo zaměřený na žánr jazz a živá festivalová vystoupení.</popis>
    </interpret>
    <interpret id="i10">
      <nazev>Neon Tide</nazev>
      <typ_interpreta>Skupina</typ_interpreta>
      <zanr>Elektronika</zanr>
      <popis>Neon Tide je fiktivní skupina zaměřený na žánr elektronika a živá festivalová vystoupení.</popis>
    </interpret>
    <interpret id="i11">
      <nazev>Neon Aura</nazev>
      <typ_interpreta>Solo</typ_interpreta>
      <zanr>Hip-Hop</zanr>
      <popis>Neon Aura je fiktivní solo zaměřený na žánr hip-hop a živá festivalová vystoupení.</popis>
    </interpret>
    <interpret id="i12">
      <nazev>Neon Whisper</nazev>
      <typ_interpreta>Skupina</typ_interpreta>
      <zanr>Folk</zanr>
      <popis>Neon Whisper je fiktivní skupina zaměřený na žánr folk a živá festivalová vystoupení.</popis>
    </interpret>
    <interpret id="i13">
      <nazev>Crimson Echo</nazev>
      <typ_interpreta>Solo</typ_interpreta>
      <zanr>Rock</zanr>
      <popis>Crimson Echo je fiktivní solo zaměřený na žánr rock a živá festivalová vystoupení.</popis>
    </interpret>
    <interpret id="i14">
      <nazev>Crimson Pulse</nazev>
      <typ_interpreta>Skupina</typ_interpreta>
      <zanr>Pop</zanr>
      <popis>Crimson Pulse je fiktivní skupina zaměřený na žánr pop a živá festivalová vystoupení.</popis>
    </interpret>
    <interpret id="i15">
      <nazev>Crimson Drift</nazev>
      <typ_interpreta>Solo</typ_interpreta>
      <zanr>Jazz</zanr>
      <popis>Crimson Drift je fiktivní solo zaměřený na žánr jazz a živá festivalová vystoupení.</popis>
    </interpret>
    <interpret id="i16">
      <nazev>Crimson Horizon</nazev>
      <typ_interpreta>Skupina</typ_interpreta>
      <zanr>Elektronika</zanr>
      <popis>Crimson Horizon je fiktivní skupina zaměřený na žánr elektronika a živá festivalová vystoupení.</popis>
    </interpret>
    <interpret id="i17">
      <nazev>Crimson Mirage</nazev>
      <typ_interpreta>Solo</typ_interpreta>
      <zanr>Hip-Hop</zanr>
      <popis>Crimson Mirage je fiktivní solo zaměřený na žánr hip-hop a živá festivalová vystoupení.</popis>
    </interpret>
    <interpret id="i18">
      <nazev>Crimson Bloom</nazev>
      <typ_interpreta>Skupina</typ_interpreta>
      <zanr>Folk</zanr>
      <popis>Crimson Bloom je fiktivní skupina zaměřený na žánr folk a živá festivalová vystoupení.</popis>
    </interpret>
    <interpret id="i19">
      <nazev>Crimson Nova</nazev>
      <typ_interpreta>Solo</typ_interpreta>
      <zanr>Rock</zanr>
      <popis>Crimson Nova je fiktivní solo zaměřený na žánr rock a živá festivalová vystoupení.</popis>
    </interpret>
    <interpret id="i20">
      <nazev>Crimson Wave</nazev>
      <typ_interpreta>Skupina</typ_interpreta>
      <zanr>Pop</zanr>
      <popis>Crimson Wave je fiktivní skupina zaměřený na žánr pop a živá festivalová vystoupení.</popis>
    </interpret>
    <interpret id="i21">
      <nazev>Crimson Sphere</nazev>
      <typ_interpreta>Solo</typ_interpreta>
      <zanr>Jazz</zanr>
      <popis>Crimson Sphere je fiktivní solo zaměřený na žánr jazz a živá festivalová vystoupení.</popis>
    </interpret>
    <interpret id="i22">
      <nazev>Crimson Tide</nazev>
      <typ_interpreta>Skupina</typ_interpreta>
      <zanr>Elektronika</zanr>
      <popis>Crimson Tide je fiktivní skupina zaměřený na žánr elektronika a živá festivalová vystoupení.</popis>
    </interpret>
    <interpret id="i23">
      <nazev>Crimson Aura</nazev>
      <typ_interpreta>Solo</typ_interpreta>
      <zanr>Hip-Hop</zanr>
      <popis>Crimson Aura je fiktivní solo zaměřený na žánr hip-hop a živá festivalová vystoupení.</popis>
    </interpret>
    <interpret id="i24">
      <nazev>Crimson Whisper</nazev>
      <typ_interpreta>Skupina</typ_interpreta>
      <zanr>Folk</zanr>
      <popis>Crimson Whisper je fiktivní skupina zaměřený na žánr folk a živá festivalová vystoupení.</popis>
    </interpret>
    <interpret id="i25">
      <nazev>Velvet Echo</nazev>
      <typ_interpreta>Solo</typ_interpreta>
      <zanr>Rock</zanr>
      <popis>Velvet Echo je fiktivní solo zaměřený na žánr rock a živá festivalová vystoupení.</popis>
    </interpret>
    <interpret id="i26">
      <nazev>Velvet Pulse</nazev>
      <typ_interpreta>Skupina</typ_interpreta>
      <zanr>Pop</zanr>
      <popis>Velvet Pulse je fiktivní skupina zaměřený na žánr pop a živá festivalová vystoupení.</popis>
    </interpret>
    <interpret id="i27">
      <nazev>Velvet Drift</nazev>
      <typ_interpreta>Solo</typ_interpreta>
      <zanr>Jazz</zanr>
      <popis>Velvet Drift je fiktivní solo zaměřený na žánr jazz a živá festivalová vystoupení.</popis>
    </interpret>
    <interpret id="i28">
      <nazev>Velvet Horizon</nazev>
      <typ_interpreta>Skupina</typ_interpreta>
      <zanr>Elektronika</zanr>
      <popis>Velvet Horizon je fiktivní skupina zaměřený na žánr elektronika a živá festivalová vystoupení.</popis>
    </interpret>
    <interpret id="i29">
      <nazev>Velvet Mirage</nazev>
      <typ_interpreta>Solo</typ_interpreta>
      <zanr>Hip-Hop</zanr>
      <popis>Velvet Mirage je fiktivní solo zaměřený na žánr hip-hop a živá festivalová vystoupení.</popis>
    </interpret>
    <interpret id="i30">
      <nazev>Velvet Bloom</nazev>
      <typ_interpreta>Skupina</typ_interpreta>
      <zanr>Folk</zanr>
      <popis>Velvet Bloom je fiktivní skupina zaměřený na žánr folk a živá festivalová vystoupení.</popis>
    </interpret>
    <interpret id="i31">
      <nazev>Velvet Nova</nazev>
      <typ_interpreta>Solo</typ_interpreta>
      <zanr>Rock</zanr>
      <popis>Velvet Nova je fiktivní solo zaměřený na žánr rock a živá festivalová vystoupení.</popis>
    </interpret>
    <interpret id="i32">
      <nazev>Velvet Wave</nazev>